{
  "symbol": "CN:920392",
  "market": "CN",
  "ticker": "920392",
  "name": "佳合科技",
  "currency": "CNY",
  "status": "active",
  "current_rating": "avoid",
  "current_thesis": "越南与广德扩张尚未转化为归母自由现金流，当前高估值已透支资本回报改善预期。",
  "fair_value_range": [7.0, 9.0],
  "buy_zone": [5.5, 6.8],
  "sell_or_reduce_zone": [11.0, 15.0],
  "position_plan": [
    {
      "condition": "股价处于5.5至6.8元且广德亏损收窄、应收周转未恶化、自由现金流改善",
      "max_weight": 0.015
    },
    {
      "condition": "基本面恶化或股价高于11元且盈利未同步上修",
      "max_weight": 0.0
    }
  ],
  "latest_report": "reports/2026-07-14-initial.md",
  "report_history": [
    "reports/2026-07-14-initial.md"
  ],
  "review_triggers": [
    {
      "type": "date",
      "date": "2026-08-31",
      "reason": "复核2026年半年报、广德亏损、应收账款及自由现金流"
    }
  ],
  "price_triggers": [
    {
      "type": "price_below",
      "price": 6.8,
      "reason": "进入有安全边际的研究买入区，仍须先验证核心假设"
    },
    {
      "type": "price_above",
      "price": 11.0,
      "reason": "进入减仓或不应追高区间"
    }
  ],
  "updated_at": "2026-07-18T18:00:00+08:00"
}
